{
  "schemaVersion": 1,
  "entityType": "encodeJob",
  "jobId": "job_so-we-sleep_01_encode_20260523",
  "albumId": "album_so-we-sleep",
  "trackId": "track_so-we-sleep_01",
  "status": "succeeded",
  "requestedAt": "2026-05-23T00:00:00Z",
  "startedAt": "2026-05-23T00:00:01Z",
  "finishedAt": "2026-05-23T00:00:08Z",
  "input": {
    "bucket": "tsonu-music-masters",
    "key": "masters/album_so-we-sleep/track_so-we-sleep_01/source.wav"
  },
  "output": {
    "bucket": "tsonu-music-media",
    "prefix": "draft/encodes/job_so-we-sleep_01_encode_20260523",
    "assets": [
      {
        "assetId": "asset_so-we-sleep_01_hls",
        "path": "draft/encodes/job_so-we-sleep_01_encode_20260523/hls/master.m3u8",
        "mimeType": "application/vnd.apple.mpegurl",
        "fileSizeBytes": 180,
        "checksumSha256": "aaaaaaaaaaaaaaaaaaaaaaaaaaaaaaaaaaaaaaaaaaaaaaaaaaaaaaaaaaaaaaaa"
      },
      {
        "assetId": "asset_so-we-sleep_01_aac_192",
        "path": "draft/encodes/job_so-we-sleep_01_encode_20260523/hls/192k/index.m3u8",
        "mimeType": "application/vnd.apple.mpegurl",
        "fileSizeBytes": 220,
        "checksumSha256": "bbbbbbbbbbbbbbbbbbbbbbbbbbbbbbbbbbbbbbbbbbbbbbbbbbbbbbbbbbbbbbbb"
      },
      {
        "assetId": "asset_so-we-sleep_01_aac_320",
        "path": "draft/encodes/job_so-we-sleep_01_encode_20260523/hls/320k/index.m3u8",
        "mimeType": "application/vnd.apple.mpegurl",
        "fileSizeBytes": 220,
        "checksumSha256": "cccccccccccccccccccccccccccccccccccccccccccccccccccccccccccccccc"
      },
      {
        "assetId": "asset_so-we-sleep_01_metadata",
        "path": "draft/encodes/job_so-we-sleep_01_encode_20260523/metadata.json",
        "mimeType": "application/json",
        "fileSizeBytes": 180,
        "checksumSha256": "dddddddddddddddddddddddddddddddddddddddddddddddddddddddddddddddd"
      },
      {
        "assetId": "asset_so-we-sleep_01_flac",
        "path": "draft/encodes/job_so-we-sleep_01_encode_20260523/lossless.flac",
        "mimeType": "audio/flac",
        "fileSizeBytes": 12345678,
        "checksumSha256": "eeeeeeeeeeeeeeeeeeeeeeeeeeeeeeeeeeeeeeeeeeeeeeeeeeeeeeeeeeeeeeee"
      }
    ]
  },
  "metadata": {
    "durationSeconds": 180,
    "codecName": "pcm_s24le",
    "sampleRateHz": 48000,
    "channels": 2,
    "loudness": {
      "integratedLufs": -14.5,
      "truePeakDbfs": -1.1,
      "loudnessRangeLu": 3.4,
      "thresholdLufs": -24.9
    }
  },
  "ffmpeg": {
    "version": "6.x",
    "args": ["-i", "source.wav", "-f", "hls"]
  }
}
